url,text,category
https://www.bbc.com/somali/articles/cpd8gngjy63o,"Garsoore Trump ka diiday go'aan Soomaalida ku fuli lahaa toddobaadka soo socda
Xigashada Sawirka, Getty Images
Garsoore heer federaal ah oo ku sugan Boston ayaa Jimcihii si ku-meel-gaadh ah u joojisay qorshe ay maamulka Madaxweyne Donald Trump ku doonayeen in toddobaadka soo socda lagu soo afjaro ilaalinta sharci ee u oggolaanaysay ku dhowaad 1,100 Soomaali ah inay ku noolaadaan oo ka shaqeeyaan dalka Maraykanka.
Garsooraha Maxkamadda Degmada ee Allison Burroughs ayaa soo saartay amar dib u dhigaya taariikhda 17-ka March, oo ahayd maalinta ay waaxda arrimaha gudaha Maraykanku ee US Department of Homeland Security qorsheynaysay in lagu joojiyo qorshii ilaalinta soogalootiga Soomaalida ee ku meelgaadhka ahaa.
Burroughs, oo uu magacaabay madaxweynihii hore Barack Obama, ayaa sheegtay in cawaaqib ""culus"" ay ka dhalan karaan haddii aan si degdeg ah loo hakinin go'aanka lagu soo afjarayo TPS-ka Soomaalida inta dacwaddoodu socoto.
""Dacwad-oogayaashu waxay sheegeen in haddii TPS-ka Soomaaliya la joojiyo, in in ka badan kun qof ay wajihi doonaan 'khataro daran oo culus', oo ay ku jiraan xabsi iyo masaafurin, oo gaadhsiisan waxyeello nafeed haddii lagu celiyo Somalia, iyo sida oo kale iyaga oo ka fogaanaya qoysaskooda.""
Waxay si maamul ah u hakisay dhaqan-galka go'aankaas, waxayna dejisay jadwal ay ku go'aaminayso sida ugu dhakhsaha badan codsiga Soomaalida ee ah in la helo xannibaad muddo dheer ah oo ka dhan ah tallaabada Wasaaradda Arrimaha Gudaha ee DHS.
Afhayeen u hadlay DHS ayaa amar-ka garsooraha ku tilmaamay:
""Waa tusaalihii ugu dambeeyay ee garsoorayaal u dhaqmaya sidii diranayaal ama dadka u ololeeya xuquuqaha oo isku dayaya inay ka hor istaagaan madaxweyne Trump inuu dib u soo celiyo hufnaanta nidaamka socdaalka sharci ee Maraykanka.""
Warbixinada qotada dheer iyo wararka BBC Somali oo toos kuugu imanaaya WhatsApp.
Temporary Protected Status (TPS) waa nidaam bini'aadantinimo oo ka ilaaliya soogalootiga u qalma masaafurin, isla markaana u oggolaada inay shaqeeyaan. Intii uu Trump xilka hayay, DHS waxay qaaday tallaabooyin lagu joojinayo TPS-ka in ka badan 12 dal, taas oo dhalisay dacwado badan oo maxkamadeed.
Garsooraha Burroughs ayaa go'aankeeda soo saartay iyadoo maamulka Trump uu weli sugayo go'aan ka imanaya Maxakamadda sare ee US Supreme Court, kaas oo go'aamin doona in la qaado amarrada maxkamadaha hoose ee joojiyay qorshaha lagu soo afjarayo TPS-ka in ka badan 350,000 Haitian ah iyo ku dhowaad 6,000 Syrian ah.
Xoghayaha amniga gudaha ee xilka ka sii degaya Kristi Noem ayaa bishii January ku dhawaaqday in TPS-ka Soomaalida la joojin doono 17-ka March, iyadoo ku doodday in xaaladda Soomaaliya ay soo hagaagtay, inkastoo ay weli socdaan dagaallo u dhexeeya ciidamada Soomaaliya iyo kooxda Al Shabaab.
Afar Soomaali ah iyo ururrada u dooda muhaajiriinta ee African Communities Together iyo Partnership for the Advancement of New Americans ayaa dacwad ka gudbiyay, iyagoo ku doodaya in go'aankaasi uu ahaa mid habraac ahaan khaldan oo ay ka dambaysay ajande hore loo sii qorsheeyay oo takoor ku salaysan.
Waxay sheegeen in maamulka Trump uu joojinayo TPS-ka Soomaalida iyo dalal kale sababo la xidhiidha eex ka dhan ah muhaajiriinta aan caddaanka ahayn, halkii ay ka ahaan lahayd qiimeyn dhab ah oo ku saabsan xaaladaha dalalkaas. Waxay sidoo kale xuseen hadallo hore oo Trump ku sheegay Soomaalida ""khashin"" iyo ""dad garaadkoodu hooseeyo.""
Agaasimaha fulinta ee ururka Partnership for the Advancement of New Americans, Ramla Sahid, ayaa sheegtay in amarka maxkamaddu uu ka dhigan yahay in inta dacwadda socoto:
""bulsho dhan oo sharafteeda iyo dareenkooda lahaansho ay la kulmeen weerarro cunsuriyadeed iyo cadaalad-darro ah ay hadda neefsan karaan oo heli karaan wax yar oo nafisaad.""
© 2026 BBC. BBC masuul kama ahan macluumadka bogagga kale ee dibadda. Akhri xogta ku saabsan sida aan u abaarno bogagga dibadda.",crime-related
https://www.bbc.com/somali/articles/cg7exr9yv94o,"Maxaa ka jira in Somaliland ay saldhig siisay Israa'iil?
Warbixin uu wargeyska Maraykanka ee Bloomberg daabacay toddobaadkan ayaa lagu sheegay in Israel ay wada-hadallo la yeelatay Jamhuuriyadda Iskeed ugu Dhawaaqday Madax-bannaanida ee Somaliland, kuwaas oo khuseeya iskaashi amni, si gaar ah in saldhig ay ka helaan gobolkaas, ay suurtagalnimada ka mid tahay.
Warbixinta ayaana sheegtay in goobta sida gaarka ah isha loogu hayaa ay tahay magaalo xeebeedda Berbera, qorshuhuna yahay in saldhiggaas ciidan lagaga hortago xoogagga Xuutiyiinta ee Yemen, sida oo Kalena lagala soconaya xaalka amni ee Badda Cas.
Haddaba BBC-da oo faahfaahin dheeraad iyo jiritaanka dhacadadan xaqiijinaysa ayaa waraysi gaar ah la yeelatay Wasiirka Arrimaha Dibadda ee Somaliland Cabdiraxmaan Daahir Aadan, kaas oo gebi ahaan ba meesha ka saaray qorshaha 'saldhigga' ee maalmihii u dambeeyey warbaahinta ku baahay.
Wasiirka ayaa sheegay in Somaliland iyo Israel ay leeyihiin xidhiidh ku dhisan aqoonsi is-dhaafsi ah. Wuxuu yidhi ""labada dal"" si rasmi ah ayay isu aqoonsadeen 'midba midka kale', taas oo u oggolaanaysa xidhiidh diblomaasiyadeed iyo mid dhaqaale, balse aysan ku jirin wax heshiisyo militari ah.
Markii la weydiiyay wararka sheegaya in Israel loo oggolaaday saldhig ciidan oo ku yaal Somaliland, wasiir Cabdiraxmaan ayaa si cad u beeniyay.
Wuxuu sheegay in uusan jirin wax heshiis ah oo ku saabsan saldhig militari, isla markaana hadallada mas'uuliyiinta warbaahinta qaar xigteen laga lumiyey macnahoodii dhabta ahaa.
Wasiirku wuxuu intaas ku daray in Somaliland aysan gelin heshiisyo qarsoodi ah. Wuxuu sheegay in sheegashooyinka ku saabsan wada-hadallo qarsoon ay yihiin ""borobagaando"" lagu khalkhal gelinayo mowqifka Somaliland.
Xigashada Sawirka, Abdirahman Adam/X
""Warbixinnadan sax ma aha… kuwa sheegaya in Xuutiyiinta halkan laga weerari doono iyo wax la midka ah faafinaya, waa kooxo cadow ku ah Somaliland.""
Warbixinada qotada dheer iyo wararka BBC Somali oo toos kuugu imanaaya WhatsApp.
Kooxda Xuutiyiinta ee ay taageerto Iiraan ayaa xukuma inta badan waqooyi-galbeed ee Yaman tan iyo markii ay ka saareen dowladda caalamku aqoonsan yahay gobolkaas ku dhowaad toban sano ka hor, taas oo dhalisay dagaal sokeeye oo aad u ba'an.
Bishii Janaayo ee sannadkii hore, madaxweynaha Mareykanka Donald Trump ayaa mar kale ku daray Xuutiyiinta liiska ""ururrada argagixisada caalamiga ah,"" sababo la xiriira weerarradooda ka dhanka ah maraakiibta ku sugan Badda Cas iyo in ay bartilmaameedsadaan Israa'iil.
Taariikhdu markii ay ahayd 16-kii Janaayo, hoggaamiyaha Xuutiyiinta Abdul-Malik al-Houthi ayaa ka digay in joogitaan kasta oo Israel ku yeelato Somaliland loo tixgelin doono bartilmaameed ciidan. Arrintan ayaa sidoo kale dhalisay dhaleeceyn ka timid Dawladda Federaalka Soomalaiya, halkaas oo Madaxweyne Xasan Sheekh Maxamuud uu hore ugu sheegay warbaahinta Al Jazeera wareysi uu siiyey bishii Febraayo in tallaabo noocaas ahi ay waxyeelayso madax-bannaanida Soomaaliya.
Dhanka xiisadaha gobolka, Somaliland ayuua ku sheegay 'in aysan qayb ka ahayn colaadaha ka socda gobolka, isla markaana aysan si gaar ah ugu nuglayn hanjabaadaha cid gaar ka imanaya.'
Waxaana Wasiirka Arimaha Dibedda Somaliland, uu BBC-da u sheegay in xidhiidhka Somaliland la leedahay Israel uu la mid yahay xidhiidhada ay dalal kale oo gobolka ka mid ahiba la leeyihiin Israel.
Wasiirka ayaana intaa ku daray 'in ka Somaliland ay u furan yihiin iskaashiyo dhaqaale, kuwo kale oo istaraatiiji ahba ay la yeeshaan Israel, balse hadda wax heshiis aanu hadda jiran, waddahadalladooda mustaqbalkauna noqon doonaan kuwo banyaal ah'
""Waxaan yeelan karnaa xidhiidh dhaqaale, waxaan yeelan karnaa xidhiidho kale oo istaraatiiji ah… marka waqtigu yimaado ayaan ka wada hadli doonnaa heshiisyada gaarka ah.""
Israel ayaa Somaliland aqoonsatay dhammaadkii bishii December ee sanadkii hore. Aqoonsigaas oo muran badan iyo walaac ka dhaliyey gobolka xilli dawlado tiro ah ay dhalleeceeyeen. Soomaaliya ayaana xadgudub ku tilmaantay tallaabadaas.
Dhanka kale, wasiirka arrimaha dibedda Israel ayaa isna tegay Somaliland.
Israel ayaa maalmihii u dambeeyey xaalad dagaal ku jirtay, xilli gobolka Bariga Dhexe ay iyaga Maraykanku oo isku dhinac ah weerarro kala dhexeeyaan Iran iyo kooxaha ay taageerto sida Xisbullaah.
© 2026 BBC. BBC masuul kama ahan macluumadka bogagga kale ee dibadda. Akhri xogta ku saabsan sida aan u abaarno bogagga dibadda.",crime-related
https://www.bbc.com/somali/articles/c07jr15nep2o,"Arday cabay dhiigga haweeney 90 jir aheyd iyo sabab la yaab leh oo uu sidaa u sameeyay
Xigashada Sawirka, Getty Images
Digniin: Maqaalkan waxaa ku jiro waxyaabo aad dhibsan karto
Waxay ahayd habeen Sabti ah, taariikhduna ku beegneyd Nofeembar 2001-dii markii haweeney 90 jir ah oo lagu magacaabo Mabel oo gurigeeda ku daawaneysay TV ay maqashay cod dheer oo ka imaanaya bannaanka iyo roob. Haweeneyda oo dhaga cusleyd waxaa jiray cod kale oo aysan maqal. Codkaas wuxuu ahaa dhawaqa daaqad la jabinayo iyo wiil dhallinyaro ah oo guriga soo galaya.
Habeenkaas wixii ka dhacay guriga ayaa si weyn u gilgilay tuuladii yarayd ee Ingiriiska oo ay ku nooleyd Mabel. Ku dhowaad 25 sano kaddib dhacdadaas, sarkaalka baaritaanka waday ayaa ku tilmaamay dambigii ugu naxdinta badnaa ee uu arko intii uu shaqaynayay.
Mabel waxay aheyd 90 jir weli firfircoonaa. Waxay ku nooleyd gurigaas tan iyo markii ninkeedu geeriyoday sannadihii 1960-meeyadii.
Tuulada ay ku nooleyd waxay aheyd meel dadka oo dhan is yaqaanaan oo xitaa aan guryaha la xiran. Balse dhacdadaas kaddib wax walba way isbeddaleen.
Matthew Hardman oo ahaa arday 17 jir ah ayaa guriga ugu galay Mabel. 22 jeer ayuu toorey ku dhuftay kaddibna wuxuu bilaabay fal la yaab leh.
Matthew wuxuu bilaabay in dhiigga Mabel oo uu ku shubtgo koob kaddibna uu cabo. Maalintii xigtay ayaa meydka Mabel waxaa helay qof iskaa wax u qabso deegaanka ka sameyn jiray kaas oo marar badan cunto u keenay.
John Clayton oo ahaa sarkaal hore uga tirsanaa booliska North Wales ayaa ka sheekeeyay wixii uu xususutay.
Warbixinada qotada dheer iyo wararka BBC Somali oo toos kuugu imanaaya WhatsApp.
""Waxaan u maleynayaa in ay jireen calaamado bushimo qofka oo laga helay koobka, taasoo ka dhigan in ay u badan tahay in uu cabbay dhiigga dhibbanaha.'""
Maxaa ku kalifay in qof sidaa sameeyo? Booliska ayaa ka shakiyay dhammaan dadka tuulada sida uu sheegay John Clayton. ""Booliska waxaa lagu amray in ay muhiimad siiyaan qof kasta oo guriga Mabel imaan jiray.""
Tuhun iyo warar badan ayaa ka dhashay xaaladda. Dambiilaha ayaa ahaa qof ku dhow qoys ahaan Mabel.
Matthew, oo ahaa wiil dhalinyaro ah oo wargeysyada qeybiya, ayaa imaan jiray guriga Mabel maalin kasta, wuxuuna ogaa in ay kaligeed ku nooshahay.
Markii la xiray Matthew wuxuu isku dayay in uu iska dhigo qof aan la socon. Balse intii ay baarista socotay oo aheyd labo toddobaad waxaa soo baxay xaqiiqooyin yaab leh.
Matthew waxyaabihii uu ku celcelinayay waxay aheyd erayga ""vampires"", magacaas waa jilayaal khayaali ah oo caba dhiigga dadka, wuxuuna doonayay in uu noqdo sidooda oo kale oo uusan dhimman.
Labo bilood ka hor inta uusan falka dilka geysan, Matthew wuxuu ardayad Jarmal ah ka baryay in ay cunaha iska jart, wuxuu aaminsanaa in gabadhaas ay tahay maqluulq aan dhimman sida sheekada khuraafaadka ee ""vampire"".
Matthew Hardman waxaa lagu helay dilka Mable, waxaana lagu xukumay xabsi daa'im. Maxkamadda waxaa loo sheegay DNA-ga laga helay goobta dambiga in uu la mid ahaa dhiigga ku yaallay mindida laga helay guriga Matthew. Sidoo kale raadadkii cagihiisa ayaa laga helay guriga Mabel.
Inkasta oo ay ka soo wareegtay ku dhowaad 25, hadana waa fal naxdin leh oo weli la xusuusto.
Ben Roberts oo ahaa deris la aha Mabel wuxuu jiray markii uu dilka dhacayay qiyaastii 10 sano. Wuxuu yiri, ""Markii aan 10 jirka ahaa, waxaan ka baqi jiray in aan galo meelaha mugdi ah, sababtoo ah da'daas waxaan rumaysnaa in ay jiraan waxyaabo cabsi ah"".
Wuxuu sidoo kale sheegay in dhacdadaas kaddib uu mararka qaar cabsan jiray, isagoo yiri,
""Marka aan kubbadda bannaanka ku ciyaarayo hadii ay gasho geedaha, waxaan ka baqi jiray in dilaaga uu halkaas ka soo baxo"".
Sannadkii 2003-dii, Matthew Hardman wuxuu codsaday in uu racfaan ka qaato xukunka maxkamadda, laakiin codsigaas waa la diiday. Codsigiisii ahaa in si shuruud ah lagu sii daayo ayaa sidoo kale la diiday sanadkii 2014-kii.
© 2026 BBC. BBC masuul kama ahan macluumadka bogagga kale ee dibadda. Akhri xogta ku saabsan sida aan u abaarno bogagga dibadda.",crime-related
https://www.bbc.com/somali/articles/cn87kpzdpxpo,"Dacwad sharci oo ka hortimid go'aanka maamulka Trump ee lagu joojinayo sharcigii ilaalin jiray Soomaalida Maraykanka
Xigashada Sawirka, Getty Images
Sida ay daabacday wakaaladda wararka ee Reuters koox u doodda xuquuqda muhaajiriinta ayaa Isniintii gudbiyay dacwad sharci ah oo lagu doonayo in lagu joojiyo qorshaha maamulka madaxweynaha Mareykanka Donald Trump ee lagu soo afjarayo toddobaadka dambe ilaalinta sharci ee u oggolaanaysa ku dhowaad 1,100 Soomaali ah inay ku noolaadaan oo ka shaqeeyaan Mareykanka.
Dacwaddan, oo ay soo gudbiyeen afar Soomaali ah iyo laba urur oo u dooda xuquuqda muhaajiriinta, waxay ka hortimid go'aanka Wasaaradda Amniga Gudaha ee Mareykanka (DHS) ee lagu joojinayo Barnaamijka Ilaalinta ku meel gaadhka ah ee loo yaqaanno (TPS) ee muhaajiriinta Soomaalida, kuwaas oo Trump marar badan ku aflagaadeeyay fagaareyaal. Xoghayihii Amniga Gudaha ee xilka ka degayay Kristi Noem ayaa bishii Janaayo ku dhawaaqday in TPS-ka Soomaalida la joojin doono 17-ka Maarso, iyadoo ku doodday in xaaladda Soomaaliya ay soo hagaagtay, inkastoo dagaallo ay weli u socdaan ciidamada Soomaaliya iyo maleeshiyaadka Al-Shabaab.
Dacwad oogayaasha, oo ay ku jiraan ururrada African Communities Together iyo Partnership for the Advancement of New Americans, ayaa ku doodaya dacwadda laga gudbiyay maxkamadda federaalka ee Boston in ay ahayd mid habraac ahaan khaldan isla markaana ay ka dambeysay ajande hore loo qorsheeyay oo takoor ah.
Dacwadda ayaa sidoo kale xustay hadallo badan oo Trump sheegay, kuwaas oo uu Soomaalida ku tilmaamay ""qashin"" iyo ""dad garaad ahaan hooseeya"" oo aan ""waxba ku deeqayn."" Dacwa-ogayaashu waxay sheegeen in maamulka uu joojinayo TPS-ka Soomaaliya iyo dalal kale sababo la xidhiidha eex aan dastuurka waafaqsanayn oo ka dhan ah muhaajiriinta aan caddaanka ahayn, halkii ay ku salayn lahaayeen qiimeyn dhab ah oo ku saabsan xaaladaha dalalkaas.
""Joojinta TPS-ka Soomaaliya waa cunsuriyad isu ekeysiisay siyaasadda socdaalka,"" ayuu yidhi Omar Farah, oo ah agaasimaha fulinta ee kooxda sharci ee Muslim Advocates.
Wasaaradda Amniga Gudaha (DHS) kama aysan jawaabin codsi faallo ah. Hore waxay u sheegtay in TPS ""waligiis aan loogu talagelin inuu noqdo barnaamij cafis guud oo joogto ah.""
TPS waa nooc ka mid ah ilaalinta bini'aadantinimo ee socdaalka oo ka ilaalisa muhaajiriinta in la matatariyo isla markaana u oggolaanaysa inay shaqeeyaan. Intii ay xilka haysay Noem, DHS waxay qaaday tallaabooyin lagu joojinayo TPS ee ku dhowaad toban dal, taasoo dhalisay dacwado sharci. Maamulka ayaa Sabtidii sheegay inuu qorsheynayo inuu racfaan u gudbiyo Maxkamadda Sare ee Mareykanka si loo joojiyo magangalyada kumeelgaadh ka ah ee in ka badan 350,000 oo u dhashay dalka Haiti. Waxa kale oo uu doonayaa in maxkamadda sare ay u oggolaato joojinta magangalyada kumeel gaadhka ah ee ku dhowaad 6,000 oo Suuriyaan ah.
Soomaaliya markii ugu horreysay waxaa loo qoondeeyay TPS sanadkii 1991, iyadoo kordhintii ugu dambeysay la sameeyay 2024. Qiyaastii 1,082 Soomaali ah ayaa hadda haysta magangalyadaan kumeel gaadhka ah, halka 1,383 kale ay leeyihiin codsiyo weli jawaab sugaya, sida ay sheegtay DHS.
Warbixinada qotada dheer iyo wararka BBC Somali oo toos kuugu imanaaya WhatsApp.
Bilaha u dambeeyay Soomaalida ku nool gobolka Minnesota waxay noqdeen bartilmaameed ka mid ah tallaabooyinka adag ee socdaalka ee Trump, iyadoo mas'uuliyiin ay tilmaameen fadeexad khiyaano ah oo dad badan oo lagu soo oogay ay ka yimaadeen bulshada weyn ee Soomaalida ee gobolkaas.
Maamulka Trump ayaa eedahaas khiyaanada ah u adeegsaday saldhig ay ku qaadaan hawlgal muddo bilo ah socday oo lagu xoojinayo fulinta sharciga socdaalka ee Minnesota oo ay hoggaamiyaan Dimuqraadiyiintu, halkaas oo ku dhowaad 3,000 oo wakiil oo socdaal ah la geeyay. Arrintaas ayaa dhalisay mudaharaadyo waxayna horseeday in laba muwaadin oo Mareykan ah ay dileen wakiillo federaal ah.
Bishii Nofeembar Trump wuxuu ku dhawaaqay inuu joojin doono TPS-ka Soomaalida ku nool Minnesota, bil kadibna wuxuu sheegay inuu doonayo in loo diro ""meeshii ay ka yimaadeen.""
Wasaaradda Arrimaha Dibadda ee Mareykanka ayaa dadka uga digta safarka Soomaaliya, iyadoo sabab uga dhigaysa dambiyo, rabshado sokeeye iyo arrimo kale oo badan.
© 2026 BBC. BBC masuul kama ahan macluumadka bogagga kale ee dibadda. Akhri xogta ku saabsan sida aan u abaarno bogagga dibadda.",crime-related
https://www.bbc.com/somali/articles/c14vxp6dye4o,"Sida bakteeriyo laga helo xubinta taranka haweenka ay ugu fiican tahay caafimaadka
Xigashada Sawirka, Getty Images
Bakteeriyada nooca microbiome ee laga helo xubinta taranka haweenka ma aysan helin daneyn badan si la mid ah tan laga helo uur ku jirta – balse bakteeriyo si wacan u dheellitiran oo ku jirta xubinta taranka haweenka ayaa gacan ka geysan karta guud ahaan caafimaadkaaga.
Gudaha xubinta taranka waa hannaan jilicsan, oo ka sameysan kumannaan nooc oo bakteeriyo ah, fungas iyo fayrasyo isku maran, oo tartan ugu jira nafaqooyin iyo meel bannaan oo ay ku koraan.
Qaar ka mid ah bakteeriyada ku nool xubinta taranka haweenka ayaa door cajiib ah oo togan ku yeelan kara caafimaadka guud ahaan – laga soo bilaabo ka hortagga cudurka ilaa hagaajinta xaaladaha uurka. Markii vakteeriyada loo yaqaan Lactobacillus ay aad u badan tahay, khatarta dhalmo la'aanta, dhiciska, ilmaha oo xilligooda kahor dhasha iyo xitaa kansarka makaanka ayaa dhammaan yaraada.
Saynisyahannada ayaa haatan u degdegaya inay soo saaraan baaritaanno iyo daaweyn si wanaagsan loogula tacaali karo noolahan il ma qabatada ah. Haddii la garwaaqsado muhiimadda bakteeriyadan, waagan cusub ee daaweynta ayaa dib u ikhtiraaci kara daryeelka caafimaadka xubinta taranka ee haweenka.
Marka sidee ayay bakteeriyada xubinta taranka u saadaalin kartaa caafimaadka – maxaana la sameyn karaa si loo ilaaliyo?
""Waxay dilaan bakteeriyada xun. Waxay ka hortagaan in bakteeriyadaas xun ay sii korto. Waxay xoojiyaan hannaanka difaaca jirka, sidaa darteed waxay ka hor tagaan caabuqa. Waxay dilaan bakteeriyada isku dayeysa inay u gududbto jirka,"" ayay yiri Cheryl Sarkey, madaxa Hay'adda Sharciyaynta Alaabada Dawooyinka iyo Caafimaadka ee UK.
""Microbiome-ku waa sida kaynta oo kale. Ubax caafimaad qaba waxay ku koraan kayn caafimaad leh. Haddii qaab-dhismeedku aanu sax ahayn, nidaamka caafimaadku wuu lumi doonaa, ""ayuu yiri khabiirku.
Bakteeriyadani waxa kale oo ay caawisaa in la go'aamiyo xaaladda uurka ee haweenka iyo muddada dhallaanku ku sii jirayaan calooshooda.
Warbixinada qotada dheer iyo wararka BBC Somali oo toos kuugu imanaaya WhatsApp.
Dhanka kale haddii aan ka eegno, ayaa ah in haddii xaaladda bakteeriyada xubintan ay isku qasmaan – isku-dheellitir la'aantaas oo loo yaqaanno vaginal dysbiosis – markaas waxaa badanaya caabuqyada fursadaha ka faa'iidaysanaya sida bakteeriyada xubinta taranka haweenka (bacterial vaginosis - BV), iyo (candidiasis) iyo caabuqyada kaadi mareenka (urinary tract infections - UTI).
Intaa waxaa sii dheer, haddii haweeneydu ay galmo samayso, dheellitirnaan la'aantan waxay ka dhigaysaa mid aad ugu nugul inay qaaddo caabuqyada galmada lagu kala qaado. Tusaale ahaan, dumarka leh heerarka hoose ee xaaladdan isku dheellitirnaan la'aanta waxay aad ugu nugul yihiin halista HIV-ga.
""Magaalada Cape Town ee Koonfur Afrika, heerka HIV-ga wuxuu u dhexeeyaa 20-30%, haddana qaar ka mid ah kuwa jirkooda ka ganacsada waxay u muuqdaan inay nasiib leeyihiin oo ay ka badbaadaan caabuqa,"" ayay tiri Laura Goodfellow, oo ah macallimad caafimaad oo ku takhasustay caafimaadka haweenka iyo carruurta ee Jaamacadda Liverpool ee UK.
Dumarka qaba isku dheellitirnaan la'aanta bakteeriyada uxbinta taranka waxay waqti dheer ku qaadataa inay iska nadiifiyaan caabuqyada HPV-ga, waxayna leeyihiin fursad sare oo caabuqu ugu beddelmi karo kansarka afka ilmo-galeenka.
Waxaa xiiso leh, bulshada bakteeriyada ee ku nool qeybaha hoose ee xubinta taranka haweeneyda ayaa sidoo kale u muuqda inay door ka ciyaaraan go'aaminta fursadda uur-qaadidda iyo ilaa xilliga dhalmada.
Dumarka heerka hoose ee xaaladdan dheellitirnaan la'aanta Lactobacillus, tusaale ahaan, waxay u badan tahay inay ku dhacaan dhicis, ama uurka ectopic ee minka bannaankiisa ku beerka .
Dumarka qaba xaaladdan sidoo kale waxay leeyihiin fursad sare oo ah inay dhalaan ilmo dhicis ah - oo loo yaqaanno marka ilmuhu dhasho ka hor 37 toddobaad ee uurka..
Khubarradu waxay ka digayaan in adeegsiga hababka aan caafimaad ahaan lagu talin ee lagu nadiifiyo xubinta taranka ay sii xumayn karaan dhibaatada. Mid ka mid ah hababka aysan khubarradu ku talin ayaa ah in la isku dayo in xubinta taranka lagu nadiifiyo biyo gudaha loo geliyo.
Sidoo kale, isticmaalka kiriimyada (gels) iyo buufiska (sprays) laguma talinayo. Dhanka kale, kaniiniyada ka hortagga uurka saameyn kuma yeeshaan tirada bakteeriyada xubintan.
Waxaa lagula talinayaa in la raaco cunto caafimaad leh, gaar ahaan cuntooyinka qani ku ah fiitamiinnada A, C, D, iyo E. Waxaa sidoo kale muhiim ah in la isticmaalo cuntooyinka qani ku ah folic acid (folate) iyo kaalshiyamka.
Daraasado ayaa muujiyay in buurnidu ay yareyso xaddiga bakteeriyada caafimaadka qabta ee ku jirta xubinta taranka. Sidoo kale, sigaar-cabistu waxay waxyeello u geysataa caafimaadka taranka ee haweenka. Waxaa la ogaaday in boqolkiiba 15 haweenka aan cabin sigaarka ay leeyihiin ""flora"" bakteeriyada xubinta taranka oo caadi ah marka la barbar dhigo haweenka sigaarka caba.
""Cunista khudradda, helitaanka hurdo kugu filan, iyo cabidda biyo badan ayaa lagula talinayaa. Kuwani waxay gacan ka geystaan ilaalinta caafimaadka guud iyo caafimaadka taranka."" Ayuu yiri khabiirka.
© 2026 BBC. BBC masuul kama ahan macluumadka bogagga kale ee dibadda. Akhri xogta ku saabsan sida aan u abaarno bogagga dibadda.",crime-related
