url,text,category
https://www.bbc.com/somali/articles/c0e521wvzp1o,"Istaraatiijiyada dagaalka Iran ee Mareykanka ku adkeyneyso in dagaalka uu ku guuleysto
Waxay sheegeen in awoodda milatari ee Tehran la wiiqay kaddib weerarradii ay Maraykanka iyo Israa'iil ku qaadeen Iran.
""Ciidamada cirka iyo maraakiibtooda dagaalka waa la burburiyay. Hoggaamiyayaashooda waa la dilay. Waxay iga dalbadeen wadahadal. Balse waxaan ku iri, waqtigaas waa la soo dhaafay"", ayuu yiri madaxweyne Trump.
Iran waxay sii waddaa weerarro aargoosi ah oo ay ku qaadeyso Isreal iyo dalal Bariga Dhexe ah ee ay ku yaallaan saldhigyada milatari ee Marayku leeyahay.
Sidee ayay u eg tahay istaraatiijiyadda milatari ee Iran marka la fiiriyo in Maraykanka iyo Israel ay leeyihiin awood milatari oo ka sarreysa?
Sida uu sheegay Dr. H. A. Hellyer, oo ka faalooda arrimaha Bariga Dhexe, kana tirsan machadka difaaca iyo arrmaha ammaanka ee RUSI ee UK, ayaa qaba in istaraatiijiyadda milatari ee Iran aysan aheyn in ay kaga adkaato Maraykanka iyo Israa'iil ""dagaal caadi ah"".
Waxa uu ku doodayaa in dagaalka Iran uu noqonayo mid ""daba dheeraada, gobolka ku fida, kaddibna abuura qalalaase dhaqaale"".
""Iran kuma guulaysan karto dagaal caadi ah. Waxa kaliya ay ku badbaadi karto waa in ay ka hortagtaa in dalalka kale ay si fudud ku guuleystaan, waxayna sameyneysaa burbur dhaqaale"" ayuu yiri Dr Heyller.
Sida ay sheegtay Nicole Grajewski, oo ah bare ka tirsan Machadka Daraasaadka Caalamiga ee Faransiiska ayaa sheegtay in habka ay Iran qaaday uu yahay ""Dagaal lagu daalo"". Waxay dooneysaa Iran ayey tiri in ay daciifiso oo ay daalisa kuwa la dagaallamaya.
Xigashada Sawirka, NurPhoto via Getty Images
Warbixinada qotada dheer iyo wararka BBC Somali oo toos kuugu imanaaya WhatsApp.
Istaraatiijiyaddan milatari waxay sidoo kale leedahay dhinac maskaxeed. Khubaradu waxay sheegeen in markii uu socday dagaalkii 12-ka maalmood ee sanadkii hore ee ay la galeen Israa'iil, Iran waxay ""isku dayday in ay abuurto cadaadis maskaxeed iyadoo weerartay dad rayid ah oo aan waxba galabsan, si toos ahna uma beegsan bartilmaameedyada milatari."" Iran waxay inta badan adeegsatay gantaallo iyo drones.
Gantaallada ridada dheer ee Iran qaar ayaa waxyeello soo gaartay intii lagu jiray dagaalkaas 12-ka maalmood socday ee ay la galeen Israa'iil. Lama oga inta gantaal ee u hartay.
Falanqeeyayaashu waxay xuseen in Iran ay hubkeeda ku soo saarto oo ku kaydiso meelo qarsoodi ah.
Sida ay Israa'iil sheegtay, Iran waxay haysataa qiyaastii 2,500 oo gantaal, sida ku cad xog ay ururiyeen Midowga Yurub oo soo baxday Janaayo sanadkan 2026.
Gantaaladan waxay isugu jiraan kuwa ridada gaaban oo gaaraya ilaa iyo 1000 kiilomitir iyo kuwa ridada dheer oo gaaraya inta u dhexeyas1000 ilaa iyo 3,000 oo kiilomitir.
Saraakiisha Iran waxay sheegeen in ay isticmaaleen hub kale, oo ay ku jiraan sawaariiqda Sajil.
Waxaa la sheegay in gantaalkan uu gaari karo ilaa iyo 2000 oo kiilomitir. Tehran waxay ku dhawaaqday in gantaalkan uu yahay kuwa ka dheereeya guuxooda.
Warbaahinta Iran waxay sheegeen in gantaalada ay ku jiraan xarumo ku yaal dhulka hoostiisa halkaas oo lagu sameeyo laguna keydo. Waxaana lagu magacaabaa ""Magaalooyinka gantaalada"". Lama hayo xog la xaqiijiyay oo ku saabsan tirada saxda ah ama awooddooda.
Sida uu sheegay Taliska Dhexe ee Mareykanka, awooda gantaalada Iran ee gaari kara Yurub waxaa hoos loo dhigay boqolkiiba 23, waxaana keydka hoos loo dhigay 86 boqolkiiba
Sida uu sheegay Dr. H. A. Hellyer oo ka faalooda arrimaha Bariga Dhexe, Iran waxay weli awood u leedahay in ay beegsato kaabeyaasha Israel iyo saldhigyada milatari ee Maraykanka ee Bariga Dhexe. Waxay sidoo kale carqaladayn kartaa Iran maraakiibta shidaalka ee mara Marinka Hormuz taas oo saameyn dhaqaale ku yeelaneysa adduunka oo dhan.
Boqolkiiba 20 shidaalka adduunka ayaa mara halkaas. Iran waxay ku hanjabtay in ay xireyso marinkaas iyadoo weerareysa maraakiibta.
Xigashada Sawirka, Getty Images
Sida ay qabto Nicole Grajewski, inkastoo Iran aysan haysan gantaallo aad u horumarsan, hadana waxay haysataa tiro aad u badan oo drones ah.
Waxaa la rumeysan yahay in ay soo saartay kumanyaal drone ka hor dagaalka. Naqshadaha drones-kan qaar waxaa laga soo guuriyay Ruushka. Maraykanka ayaa sidoo kale isku dayay in uu isticmaalo tiknoolajiyadan. Drones-kani, marka laga reebo weerarrada tooska ah, waxay sidoo kale carqaladeeyaan hawada.
""Waa drones awood u leh in ay daciifiyaan difaaca cirka. Ruushka ayaa drone noocan oo kale ah u adeegsaday dagaalka Ukraine,"" ayay tiri Nicole Grajewski.
Maraykanka waxa uu sheegay in kaydka drones-ka Iran uu hoos u dhacay 73 boqolkiiba.
Falanqeeyayaasha waxay sheegeen hadii dagaalka sii daba dheeraado in ay adkaaneyso adeegsiga hub aad u badan.
Iran waa dal muddo dheer milatari ku lahaa Bariga Dhexe. Waxay leedahay qiyaastii 610,000 askari. Ciidamada joogtada waa 350,000 halka 190,000 ay yihiin Ilaalada Kacaanka Iran.
Iran waxay taageertaa Xuutiyiinta Yemen , iyo sidoo kale dagaalyahanno ku sugan gudaha dalka Ciraaq, Xisbullah iyo Xamaas.
Kooxahan waxay taageeraan Iran inkastoo Xamaas ay Israel aad u wiiqday awoodeeda ilaa markii uu bilowday dagaalka Gaza. Sida ay qabaan dadka ka faalooda arrimaha gobolka, Iran waxay awood u leedahay in ay gasho dagaal muddo dheer socda.
Gantaallo Iran leedahay oo galay hawada Turkiga ayaa la sheegay in ay qabteen raadaarada difaaca NATO.
Turkiga, oo hore u dalbaday in Iran iyo Maraykanku wada hadal yeeshaan, ayaa dagaalka kaddib sheegay in ""dhammaan dhinacyada ay ka fogaadaan sii hurinta colaadda.""
Ujeedka Iran ayaa ah in ay ku qasabto dalalka dagaalka wada in ay joojiyaan weerarka taas oo ah hab miiska wadahadalka uu ku imaan karo Mareykanka.
Dr. H. A. Hellyer waxa uu isna sheegay in inkastoo dalalka Khaliijka ay ka soo horjeesteen weerarka Iran, haddana waxay bilaabi karaan in ay taageeraan Maraykanka haddii weerarrada aargoosiga ee Tehran ay khatar ku noqdaan amnigooda.
© 2026 BBC. BBC masuul kama ahan macluumadka bogagga kale ee dibadda. Akhri xogta ku saabsan sida aan u abaarno bogagga dibadda.",crime-related
https://www.bbc.com/somali/articles/c2evjjj7n7zo,"Ma waxaa loo socdaa dagaalkii III ee adduunka mise waa qiyaas laga badbadiyay?
Xigashada Sawirka, Getty Images
Muddo bil ka badan ayaa laga joogaa markii uu billowday dagaalka Mareykanka iyo Israa'iil ay kula jiraan Iiraan, waxaana sii kordhayay walaaca laga qabo in colaadda Bariga Dhexe ay isku beddesho mid aad u ballaaran.
Dagaalkani waxa uu saameeyay Iran oo kaliya, balse waxa uu sidoo kale saameeyay in ka badan 12 dal iyo gobolo kale, oo ay ku jiraan Imaaraadka Carabta, Ciraaq, Baxrayn, Kuwait, Sucuudiga, Cumaan, Jamhuuriyadda Asarbayjan, Daanta Galbeed ee la haysto, Qubrus, Suuriya, Qatar, iyo Lubnaan.
Dad badan ayaa hadda is weydiinaya in khilaafkani uu ka gudbi karo heer gobol oo uu isu rogi karo dagaal caalami ah.
""Dadku waxay u maleynayaan in dagaalada si taxadar leh loo qorsheeyay iyo in kuwa dagaal gala ay si sax ah u garanayaan waxa ay sameynayaan,"" ayay tiri Margaret MacMillan, oo ah borofisar ku takhasustay taariikhda caalamiga ah ee Jaamacadda Oxford ee UK, oo la hadashay barnaamijka ""Sheekada Adduunka"" ee BBC.
""Xaqiiqdii, haddii aad eegto dagaalladii hore, sida Dagaalkii Dunida ee koobaad, wax badan oo ka mid ah qodobbada ugu dambeyntii keenay waxay ahaayeen shil ay sababtay xisaab-xumo hal dhinac ka timid,"" ayuu tiri. ""Mararka qaar waxaad u malayn kartaa inuu yahay dagaal iska caadi ah,"" ayay tiri.
Sida ay qabto Macmillan, dilkii Franz Ferdinand, oo ahaa dhaxal-sugaha Boqortooyada Australiya-Hungary, adeerna u u yahay Imbraadoor Franz Joseph, ayaa dhigay silsilad dhacdooyin ah oo horseeday dillaaca dagaalkii 1aad ee Adduunka 1914-kii.
Toddobaadyo gudahood, isbahaysi xiriir ah ayaa Yurub geliyey dagaal. Awstariya-Hungary ayaa ka dagaalantay Serbia, Jarmalku waxa uu taageeray Awstariya, Ruushku waxa uu isu abaabulay in uu taageero Serbia, Faransiiskuna waxa uu taageeray Ruushka, Ingiriiskuna waxa uu dagaalka u galay sharaf iyo dano istiraatijiyadeed.
Waxa ay sheegtay in wixii intaa ka dambeeyay ay noqdeen masiibo caalami ah.
Warbixinada qotada dheer iyo wararka BBC Somali oo toos kuugu imanaaya WhatsApp.
Joe Maiolo, oo ah borofisar taariikhda caalamiga ah ka dhiga King's College London, waxa uu ku qeexay dagaalka adduunka dagaal baaxad leh oo ay ku lug leeyihiin dhammaan quwadaha waaweyn.
Waxa uu intaa ku daray: ""Haddii aan ka hadalno dagaalka saddexaad ee aduunka, ma jirto rabitaan ka yimid Shiinaha ama Ruushka oo si toos ah u soo farageliya dagaalka, xitaa Yurub madooneyso in ay ku lugyeelato dagaalkaan.""
Waxa uu aaminsan yahay in Shiinuhu uu qorshayaal kale ka leeyahay diblumaasiyadda uu la leeyahay madaxweynaha Maraykanka Donald Trump: ""Marka ninka kula tartamaya uu sameeyo khalad weyn oo istiraatijiyadeed, waa inaad daawato oo kaliya.""
In kasta oo dagaalku saameyn ku leedahay isbedbedelka qiimaha saliidda, weli miyay danta Shiinaha ku jirtaa in aysan ciyaarin door diblomaasiyadeed?
Mr. Maiolo ayaa sheegay in tani ay tahay kharash yar: ""Marka la eego danaha istaraatiijiyadeed ee ballaaran, ka qaybgalka Mareykanka ee Bariga Dhexe ayaa aad uga muhiimsan kheyraadka saliidda ee Shiinaha.""
Xigashada Sawirka, Getty Images
Moscow ayaa ka hadashay iskaashiga ay la leedahay Iran, xiriirkan kuma qasbayo Ruushka inuu taageero militari siiyo Iran.
McMillan waxa ay sheegtay in kibirku uu door ka qaadan karo go'aamada hoggaamiyeyaasha, iyada oo farta ku fiiqday Putin: ""Waxa uu si cad u sameeyay khalad weyn oo uu isku dayay in uu ku duulo Ukraine.
Wax yar ka dib markii uu billaabay duullaan ballaaran afar sano ka hor, Putin waxa uu sheegay in hadafkiisu uu ahaa ""in uu ka saaro militariga"" Ukraine, laakiin Ms McMillan ayaa sheegtay in Ruushku uusan weli gaarin hadafkiisa milatari ee Ukraine.
Wasaaradda Difaaca ee Britain ayaa ku qiyaastay in Ruushka ay soo gaartay 1.25 milyan oo dhimasho iyo dhaawac ah, tiradaas oo ah mid aan la dhayalsan karin, ayaa ah weli ka badan tirada guud ee dhimashada Mareykanka ee Dagaalkii Labaad ee Adduunka.
© 2026 BBC. BBC masuul kama ahan macluumadka bogagga kale ee dibadda. Akhri xogta ku saabsan sida aan u abaarno bogagga dibadda.",crime-related
https://www.bbc.com/somali/articles/c747derglpko,"Falanqeyn: Trump wuxuu dhibaato dacaayad ah u beddelayaa arrin loo dabaaldego
Ciidamada Iran ayaa maanta sheegay in ay burburiyeen saddex diyaaradood oo Maraykan ah oo ku lug lahaa hawlgal raadin ah oo loogu jiray mid ka mid ah xubnaha shaqaalaha diyaaraddii Mareykanka ee la soo riday.
Iran iyo Maraykanku waxay tartan ugu jireen tan iyo Jimcihii si ay u helaan xubinta labaad ee F-15E ka hor inta uusan Donald Trump maanta shaacin in sarkaalka la helay intii lagu jiray hawlgal samatabixineed.
""Diyaaradaha cadowga ee soo galay koonfurta magaalada ""Isfahan"",""ee Iran""] — oo ay ku jiraan labo helikobtar oo Black Hawk ah iyo diyaarad xamuul milatari oo C-130 Hercules ah — ayaa la duqeeyay haddana gubanaya,"" ayaa lagu yiri war kasoo baxay saldhigga dhexe ee milatariga, ee Khatam al-Anbiya.
Wuxuu intaa ku daray in hawlgalka samatabixinta uu ""fashilmay"".
Warbaahinta dowladda ayaa soo bandhigtay sawirro muujinaya burburka diyaaradihii gubanayay oo ku daadsan dhul lamadegaan ah, iyadoo qiiq uu weli ka soo baxayo goobta.
Warbaahinta Iran ayaa sidoo kale sheegtay in duqeyn dhacday intii lagu jiray hawlgalka samatabixinta ay ku dhinteen shan qof koonfur-galbeed Iran, inkastoo aan si degdeg ah loo caddeynin in ay ahaayeen rayid ama ciidan.
Tan iyo Jimcihii, warbaahinta Iran waxay sidoo kale faafinayeen muuqaal muujinaya dadka deegaanka, qaar wata calamo iyo qoryo, oo raadinaya duuliyaha kadib markii maamulka uu ku dhawaaqay in abaalmarin la siinayo ciddii keenta xog ku saabsan.
Madaxweynaha Maraykanka Donald Trump ayaa u dabaaldegay badbaadinta askarigaas.
Warbixinada qotada dheer iyo wararka BBC Somali oo toos kuugu imanaaya WhatsApp.
Halkan waxaan idinkugu soo gudbineynaa sida ay wararku u soo baxayeen maalinba maalinta ka dambeysa:
Wakaaladda wararka Tasnim News Agency ayaa sheegtay in Maraykanku raadinayo mid ka mid ah duuliyeyaashiisa kadib markii la soo sheegay in diyaarad lagu soo riday gudaha Iran. Tani waxaa markii dambe xaqiijiyay saraakiil Maraykan ah oo la hadlay warbaahinta reer galbeedka, kuwaas oo sheegay in diyaaraddu ahayd nooca F-15E Strike Eagle.
Guddoomiyaha gobolka koonfureed ee Kohgiluyeh iyo Boyer-Ahmad ee Iran ayaa sheegay in mudnaanta koowaad ay tahay ""in la qabto"" shaqaalaha diyaaradda Maraykanka haddii ay soo dhacaan iyagoo nool, xitaa abaalmarin ayaana loo ballanqaaday qabashadooda.
Wax yar ka hor 12:00 duhurnimo (EDT), CBS News ayaa werisay in hal xubnood oo ka mid ah shaqaalihii diyaaradda la badbaadiyay, sida ay sheegeen laba sarkaal oo Maraykan ah.
Warbixintu waxay sidoo kale sheegtay in laba diyaaradood oo ka qayb qaadanayay hawlgalka samatabbixinta la weeraray. Diyaarad nooca A-10 Warthog ah ayaa la duqeeyay, duuliyihiina wuu ka booday isagoo ku dhacay Gacanka, halkaas oo lagu badbaadiyay. Shaqaalaha saarnaa helikobtarka qaaday duuliyaha la soo badbaadiyay ayaa sidoo kale dhaawacmay kadib rasaas fudud oo lagu furay isaga.
Warar kooban oo yar ayaa laga helay raadinta.
Wax yar ka hor saqda dhexe (EDT), warbaahinta Maraykanka ayaa sheegtay in duuliyihii labaad la helay.
Daqiiqado kadib, Trump ayaa ku qoray bartiisa baraha bulshada ee Truth Social in duuliyihii maqnaa uu yahay mid ""AMMAAN AH OO BADQABA"", inkastoo uu dhaawacmay, haddana ""uu si fiican u bogsan doono.""
Xigashada Sawirka, Getty Images
Sidaas ayuu Donald Trump ku bilaabay qoraalkiisa baraha bulshada ee uu ku shaaciyay badbaadinta duuliyihii labaad.
Si la filan karo, wuxuu arrintan u soo bandhigayaa guul weyn oo ay gaareen ciidamada Maraykanka, isagoo u rogaya wax markii hore u ekaa dhibaato dacaayad ah arrin loo dabaaldego.
Muddo 48 saacadood gudahood ah, wuxuu wajahayaay suurtagalnimada in askari Maraykan ah oo shaqeynaya—oo hadda la ogyahay inuu ahaa kornayl—uu gacanta u galo Iiraan, laguna soo bandhigo telefishinka dowladda.
Akoonnada baraha bulshada ee taageera Iran ayaa hore isku dayay inay ka faa'iideystaan xaaladda. Qaar waxay soo dhigeen muuqaal muujinaya askari ay eryanayaan dad deegaanka ah, halka kuwo kale ay faafiyeen sawirro been abuur ah oo lagu sameeyay garaadka macmalka ah ee AI oo muujinaya sarkaalka oo ku raaxeysanaya martigelinta Iran.
Afhayeen u hadlay Ciidanka Ilaalada Kacaanka Islaamiga ah ee Iiraan ayaa ku tilmaamay dhacdada ""maalin madow oo fadeexad ku ah"" Maraykanka.
Runtii, xaqiiqda ah in diyaaradda la soo riday markii hore waxay ka dhigtay qaar ka mid ah hadalladii buunbuuninta ahaa ee maamulka Trump ee ku saabsanaa burburinta difaacyada cirka ee Iran kuwo u muuqda nacasnimo.
Si kastaba ha ahaatee, guusha hawlgalkan samatabbixinta ee geesinnimada iyo khatarta intaba lahaa, Trump wuxuu rajeynayaa inuu dib u helo hoggaanka xaaladda, xilli ay dad badan aaminsan yihiin in jihada dagaalkan ay ka sii siibanaysay gacantiisa.
© 2026 BBC. BBC masuul kama ahan macluumadka bogagga kale ee dibadda. Akhri xogta ku saabsan sida aan u abaarno bogagga dibadda.",crime-related
https://www.bbc.com/somali/articles/cx2w9pwz0e1o,"Sidee ciidamadan gaarka ah ee Maraykanku u fuliyeen hawlgalka badbaadinta ee Iiraan?
Xigashada Sawirka, Getty Images
Warbixinno hordhac ah ayaa tilmaamaya in duuliyihii diyaaradda dagaalka ee F-15 ee Maraykanka ee lagu soo riday Iran la badbaadiyay. Haddii arrintan la xaqiijiyo, waxay noqon doontaa mid ka mid ah hawlgallo badan oo ""raadinta iyo badbaadinta dagaalka"" ah oo Maraykanku sameeyay tobannaankii sano ee la soo dhaafay.
Sida ay sheegtay Bahwadaagta BBC ee Maraykanka CBS, howlgalka raadinta ee xubinta labaad ee shaqaalaha diyaaradda ayaa weli ka socda gudaha dalka Iran.
Hawlgallada badbaadinta dagaalka waa kuwo kamid ah kuwa ugu adag uguna xasaasisan ee militariga; waana hawlo ay ciidamada Maraykanka iyo xulafadoodu sanado badan ku qaateen tababar iyo diyaar-garow.
Maraykanka gudihiisa, cutubyo gaar ah oo ka tirsan Ciidanka Cirka ayaa si gaar ah loogu tababaraa fulinta hawlgalladan, waxaana badanaa hore loogu sii diraa meelaha colaadaha ka dhici karaan, halkaas oo ay ka jirto halis ah in diyaarado la waayo.
Si fudud, waa hawlgallo militari oo lagu raadinayo oo lagu caawinayo, laguna samatabbixinayo askar dhibaataysan, oo ay ku jiraan duuliyayaasha diyaaradaha lasoo riday iyo askarta go'doonsan.
Si ka duwan hawlgallada samatabbixinta caadiga ah ee lagu sameeyo xaaladaha bini'aadantinimo ama musiibooyinka, kuwa dagaalka waxaa lagu qabtaa deegaan colaadeed ama muran uu ka taagan yahay.
Mararka qaarkood, sida hawlgalkii hadda ee laga soo sheegay Iran, waxay ka dhici karaan gudaha dhulka cadowga.
Hawlgalladan badanaa waxaa fuliya diyaaradaha qumaatiga u kaca (helicopters), iyadoo ay taageerayaan diyaarado shidaal siiya iyo kuwo kale oo milatari oo duqeymo ama ilaalin hawada ah ka sameeya aagga.
Warbixinada qotada dheer iyo wararka BBC Somali oo toos kuugu imanaaya WhatsApp.
Taliyihii hore ee ciidanka badbaadinta ee dalaayadaha ku booda ayaa CBS u sheegay in hawlgal la mid ah kan Iran uu u badan yahay inay ku lug yeeshaan ugu yaraan 24 badbaadiye oo ku shaqaynaya diyaaradaha Black Hawk.
Wuxuu sheegay in kooxdu diyaar u tahay inay ka boodaan diyaaradda haddii loo baahdo, marka ay dhulka gaaraanna mudnaanta koowaad ay tahay helidda iyo xiriir la sameynta qofka la waayay.
Haddii qofka la helo, ciidamada waxay siiyaan gargaar caafimaad, ka fogaadaan ciidamada cadowga, kadibna u dhaqaaqaan meel suurtagal ka dhigta badbaadinta.
Taliyaha ayaa intaas ku daray ""Taasi waa waxa sida saxda ah loogu tababaray meel kasta oo adduunka ah. Waxaa loogu yeeraa 'qalabka Swiss Army Knife' ee Ciidanka Cirka.""
Muuqaal la xaqiijiyay oo laga sii daayay Iran ayaa muujinaya diyaarado militari oo Maraykan ah iyo ugu yaraan hal diyaarad shidaal siineysa oo ka howlgalaysa gobolka Khuzestan.
Wakhtigu waa mid aad muhiim ugu ah hawlgalladan, maadaama ciidamada Iran ay sidoo kale isku dayayaan inay helaan qofka ama dadka Maraykanka ah.
Jonathan Hackett, oo ahaa khabiir hore oo ka tirsanaa ciidamada gaarka ah ee Marines-ka Maraykanka, ayaa sheegay in kooxaha badbaadintu marka hore raadinayaan calaamado nololeed oo muujinaya halka saaxiibkood joogo.
Wuxuu yiri ""Waxay isku dayayaan inay ka bilaabaan meesha ugu dambeysay ee qofka lagu arkay, kadibna balaariyaan raadinta, iyagoo tixgelinaya xawaaraha uu qofku ku dhaqaaqi karo xaaladaha kala duwan iyo dhulka adag.""
Hackett wuxuu intaas ku daray in hawlgalladan mararka qaar ay noqdaan ""hawlgallo soo kabasho oo gaar ah,"" iyadoo la kaashanayo xoogag maxalli ah oo hore loola xiriiray si ay u caawiyaan marka loo baahdo.
Wuxuu sheegay in koonfur-galbeed Iran ay deggan yihiin qowmiyadda Lor, kuwaas oo taariikh ahaan kasoo horjeeda dowladda jirta, islamarkaana laga yaabo inay caawiyaan shisheeyaha.
Xigashada Sawirka, Getty Images
Hawlgallada badbaadinta hawada ee dagaalka waxay leeyihiin taariikh dheer oo ka bilaabanaysa dagaalkii koowaad ee Adduunka, markii duuliyayaal ay si degdeg ah uhu degi jireen si ay u badbaadiyaan saaxiibadood.
Asalka kooxaha badbaadinta ee Maraykanka wuxuu soo bilaabmay 1943, markii laba kalkaaliye caafimaad ay u daateen Burma oo (Myanmar) loo yaqaan maanta si ay u caawiyaan askar dhaawac ah.
Sannad kadib, badbaadintii ugu horreysay ee helicopter ayaa dhacday markii sarkaal Maraykan ah uu badbaadiyay afar askari oo ka dambeeyay xariiqyada Japan.
Cutubyo rasmi ah oo badbaadin ah ayaa la sameeyay kadib Dagaalkii Koowaad ee Adduunka, balse howlgalkooda casriga ah wuxuu si dhab ah u kobcay intii lagu jiray Dagaalkii Vietnam.
Hal hawlgal oo caan ah, Operation Beit 21, ayaa sababay burburka dhowr diyaaradood iyo dhimashada askar badan iyadoo la isku dayayay badbaadinta duuliye ku dhacay dhulka Vietnam ee Waqooyi.
Dagaalkii Vietnam wuxuu si weyn u kordhiyay baaxadda iyo kakanaanta hawlgalladan, wuxuuna dhidibada u aasay farsamooyinka casriga ah ee maanta la adeegsado.
Inkasta oo dhammaan qaybaha ciidamada Maraykanku ay leeyihiin awood xaddidan oo ay ku fuliyaan hawlgalladan, Ciidanka Cirka ayaa leh mas'uuliyadda ugu weyn.
Hawshan waxaa inta badan qabta cutubyo loo yaqaan Pararescue Jumpers, kuwaas oo ka tirsan ciidamada gaarka ah.
Hal-ku-dhiggooda rasmiga ah waa: ""Waxaan sameynaa arrimahan si kuwa kale u noolaadaan.""
Shaqadoodu waxay ka tarjumaysaa ballanqaad dheer oo milatari: in aan askari lagu dayicin goobta dagaalka.
Askartan waxaa loo tababaraa inay noqdaan dagaalyahanno iyo badbaadiyeyaal isku mar, waxayna maraan mid ka mid ah tababarada ugu adag ee militariga Maraykanka.
Tababarkoodu wuxuu qaataa qiyaastii laba sano, wuxuuna ka kooban yahay:
tababar badbaado, iska-caabin iyo baxsasho
iyo koorso badbaadinta rayidka ah
Waxay sidoo kale ay qaataan tababar caafimaad dagaal, hawlgallo adag oo soo kabasho, iyo isticmaalka hubka.
Inta hawlgalku socdo, waxay ku shaqeeyaan hoggaanka saraakiil badbaadin oo qorsheeya, isku dubbarida, isla markaana fuliya hawlgallada.
Kooxaha badbaadintu si weyn ayaa loo adeegsaday dagaalladii Iraq iyo Afghanistan, iyagoo fuliyay kumannaan hawlgallo si ay u badbaadiyaan askar Maraykan ah iyo xulafadooda.
Sannadkii 2005, waxay ka qeyb qaateen badbaadinta askari ka tirsan ciidamada gaarka ah ee Marines-ka oo ku dhaawacmay Afghanistan, dhacdo markii dambe laga sameeyay filimka Lone Survivor.
Hawlgallada badbaadinta duuliyeyaasha lasoo rido ayaa noqday kuwo dhif ah sanadihii dambe.
1999, duuliyihii diyaaradda F-117 ee lagu soo riday Serbia ayaa la helay lana badbaadiyay.
Sidoo kale 1995, Bosnia, duuliye Maraykan ah oo la oran jiray Scott O'Grady ayaa lagu badbaadiyay hawlgal wadajir ah kadib markii uu lix maalmood ka dhuumanayay cadowga.
© 2026 BBC. BBC masuul kama ahan macluumadka bogagga kale ee dibadda. Akhri xogta ku saabsan sida aan u abaarno bogagga dibadda.",crime-related
https://www.bbc.com/somali/articles/cw8jxdeedylo,"Ruushka oo sameynaya hub laga baqay oo lagula dagaallamo dayax gacmeedka
Ruushka ayaa sameynaya hub cusub oo looga hartago dayax-gacmeedka sida uu Mareykanku sheegay balse weli hawada uma dirin.
Afhayeen u hadlay aqalka cad, John Kirby, ayaa hadalkan sheegay maalin ka dib markii xubin sare oo ka tirsan xisbiga Jamhuuriga uu soo saaray digniin aan cadeyn oo ah in ay jirto khatar amni oo halis ah.
Hubkan waa nooc hawada sare la dhigayo oo wata Nukliyeerka, wuxuu beegsanayaa dayax-gacmeedyada sida uu sheegay CBC news.
Mr. Kirby ma xaqiijin sida uu sheegay khamiistii, wuuna diiday in uu faahfaahiyo khatarta. Balse wuxuu sheegay in aysan khatar degdeg ah ku soo fool laheyn Mareykanka.
Moscow waxay ku eedeysay Mareykanka in hubka ay sheegayaan in Ruushku haysto ay qiil uga dhigayaan si loogu qasbo kongareeska in uu gargaar siiyo Ukraine.
Madaxweyne Biden waa loo sheegay arrintan ayuu yiri Mr. Kirby oo kaaliye sare u ah madaxweynaha.
Guddoomiyaha guddiga sirdoonka aqalka wakiilada, Mike Turner, ayaa soo saaray digniin qarsoodi ah taas oo dhalisay in warar laysla dhexmaro.
Hubka dayax-gacmeed loo adeegsado ayaa ka mid ahaa sheekooyinka qiyaaliga iyo filimada sida Superman iyo James Bond, balse khubarada militeriga waxay hore uga digeen in dayax-gacmeedka uu noqonayo safka hore ee dagaallada.
Dowladda Mareykanka weli si cad uma sheegin waxa ay tahay khatarta uu ka hadlay Mr. Kirby.
La-taliyaha ammaanka qaranka, Jake Sullivan, ayaa sheegay in aamusnaanta ay tahay ku talagal, isagoo u sheegay suxufiyiinta in ay tahay in Mareykanka uu mudnaanta siiyo habka hay’adihiisa ammaanka ku ururiyaan xogta sirdoon ee ku saabsan khatartaas.
New York Times, ABC iyo CBS waxay sheegeen in khatarta ay la xiriirto Ruushka oo sameysanayo hub nukliyeer ah oo loo adeegsan karo in lagu duqeeyo dayax-gacmeedyada Mareykanka.
Mr. Kirby wuxuu u sheegay wariyayaasha in aysan jirin cadeyn muujineysa in hubkaas la sameeyay balse wuxuu sheegay in Mareykanku dhab u qaadanayo khatartaas.
Muddo shan sano ah ayey madaxda Mareykanka iyo khubarada hawada sare ka digayeen in Ruushka iyo Shiinaha ay sameysanayaan awood militeri oo hawada sare ah si ay u gaaraan Mareykanka.
Xildhibaano sare ayaa sheegay in aysan jirin wax dadku ay ka welwelaan, balse khubarada iyo saraakiishii hore ee militeriga ayaa ka digay wax kasta oo khatar ku ah dayax-gacmeedyada Mareykanka in ay yeelan karaan saameyn weyn.
Militeriga Mareykanka si weyn ayey ugu tiirsan yihiin isagaarsiinta dayax-gacmeedka. Waxay u istcmaalaan hawlo badan oo ay ka mid yihiin in ay wax ku sahmiyaan, in uu hago gantaaladooda iyo siyaabo kale.
Aad ayaa dayax-gacmeedka loogu tiirsan yahay. Waxaa loo adeegsadaa adeegyada jiheynta, gaadiidka iyo saadaasha hawada. Nolosha dadka caadigana waxa uu ka yahay qeyb weyn.
Tan iyo xilligii dagaalkii qaboobaa ayey dalalka horumaray, gaar ahaan Maraykanka iyo itixaadkii Soofiyeeti ku tartamayeen hubka loo isticmaalo hawada sare.
Mareykanka, Ruushka iyo Shiinaha waxay leeyihiin awoodo ay ku weeraraan dayax-gacmeedka balse hub nukliyeer ma adeegsan karaan.
Saddaxduba waa saxiixayaasha heshiiska Hawada Sare ee 1967-dii kaas oo mamnuucaya in dayaxa loo diro wax kasta oo sida hub nukliyeer ah.
Matthew Kroenig oo hore uga tirsanaa difaaca iyo sirdoonka ayaa BBC-da u sheegay in ay tahay wax caadi ah in dayax-gacmeedka uu muhiim noqodo.
© 2026 BBC. BBC masuul kama ahan macluumadka bogagga kale ee dibadda. Akhri xogta ku saabsan sida aan u abaarno bogagga dibadda.",crime-related
