url,text,category
https://www.bbc.com/somali/articles/cj6dg4ye7ylo,"Ciidanka dumarka kaliya ah ee doonaya in ay gudaha u galaan Iran
Xigashada Sawirka, Valentina Sinis
BBC-du waxay booqatay koox ka mid ah dagaalyahannada Kurdiyaanka ah — waa cutub ka kooban dumar oo keliya.
Waxay qaadatay dhowr maalmood oo wadahadal iyo oggolaansho ah si loo galo godadka dhaadheer iyo marinnada dhulka hoostiisa mara ee u adeegaya saldhigga dagaalyahannada Kurdiyaanka ee ka soo jeeda Iiraan, kuwaas oo ku sugan waqooyiga Ciraaq.
Waxay maamulaan shabakad isgaarsiineed oo qarsoodi ah, waxaana aad looga yaqaannaa yar tahay gobolka Kurdistan ee ismaamula.
Iyadu waxay ahayd sawir-qaadaha keliya ee dumar ah ee loo oggolaaday inay gasho aaggaas, waxayna la qaadatay Kurdiyaanka toban maalmood.
Tobannaankii sano ee la soo dhaafay, dhowr kooxood oo fallaago Kurdiyaan ah oo ka yimid Iiraan ayaa u guuray buuraha ku yaalla xadka u dhexeeya Ciraaq.
Waxay ka dhuumanayaan sirdoonka Iiraan, kooxo Shiico ah oo ku sugan Ciraaq, iyo ciidamada Turkiga.
Dhawaan, kooxo waaweyn oo Kurdiyiin Iiraani ah oo ku sugan waqooyiga Ciraaq ayaa sameeyay isbahaysi, waxaana jiray warar sheegaya in Madaxweynihii Maraykanka Donald Trump uu si toos ah ula xiriiray hoggaamiyeyaashooda oo uu ka codsaday inay ku biiraan dagaalka.
Wareysi telefoon ah oo uu siiyay Reuters 5-tii Maarso, Trump wuxuu sheegay inuu taageeri doono weerarrada Kurdiyiintu ku qaadaan Iiraan, isagoo yiri:
Warbixinada qotada dheer iyo wararka BBC Somali oo toos kuugu imanaaya WhatsApp.
""Waxaan u maleynayaa inay aad u wanaagsan tahay haddii ay rabaan inay sidaas sameeyaan.""
Si kastaba ha ahaatee, Madaxweynaha Maraykanka ayaa Sabtidii u sheegay weriyeyaasha inuusan rabin dagaalyahannada Kurdiyaanka inay ku dagaallamaan dhulka Iiraan.
""Ma doonayno inaan dagaalka ka dhigno mid ka sii adag sidii uu hore u ahaa,"" ayuu yiri.
Iyadoo duqeymaha Maraykanka iyo Israa'iil ay sii socdeen, Iiraan waxay weerarro ku qaadday dhowr kooxood oo Kurdi ah, oo ay ku jirto weerar gantaal oo masaafo dheer ah oo lagu dilay hal dagaalyahan.
Mid ka mid ah kooxaha ugu caansan waa Free Life Party of Kurdistan (PJAK), taas oo sheegtay inay sanado badan isu diyaarinaysay inay ku laabato Iiraan.
""Waxaan u dagaallamayaa qoyskayga iyo dadka Kurdiyaanka ah ee muddo dheer la dulmiyay,"" ayay tiri Aryen oo 21 jir ah.
Iyadu waa xubin ka tirsan cutubka Ciidanka Difaaca Haweenka ee PJAK.
Aryen waxay sheegtay in iyada oo Kurdi ah ay la kulantay caddaalad darro iyo takoor gudaha Iran, taasoo ku qasabtay inay hub qaadato. Waxay ku biirtay PJAK laba sano ka hor.
Xigashada Sawirka, Valentina Sinis
Godadka iyo marinnada dhulka hoostiisa mara waa meel ammaan ah oo lagu kaydiyo cunto, lacag, iyo kayd hub.
Free Life Party of Kurdistan (PJAK) ma shaaciso tirada dagaalyahannadeeda, laakiin qiyaastii 60 dagaalyahan — badankoodna dumar — ayaa ku jiray tababar xeradan ka hor inta uusan bilaaban dagaalka u dhexeeya United States, Israel, iyo Iran.
Dagaalyahannadu waxay maraan tababaro milatari, tababar fikradeed, waxayna ku celceliyaan xirfado kala duwan sida toogashada iyo farsamooyinka diyaaradaha aan duuliyaha lahayn.
Waxay sidoo kale mareen baaritaanno caafimaad, iyagoo isu diyaarinaya in loo diro xadka, maadaama xiisadda u dhaxaysa Maraykanka iyo Iiraan ay sii kordhayso.
""Dagaalkan si weyn ayaa loo filayay,"" ayay Gelawej Ewrin oo 40 jir ah u sheegtay BBC.
Markii uu jirtay 20 sano, Ewrin waxay ka tagay waxbarashadii juqraafiyadda ee magaalada Urmia ee dalka Iran waxayna ku biirtay PJAK iyadoo ah askari lugta . Kadibna waxay noqtay afhayeen.
Iyada oo ka hadlaysay mid ka mid ah godadka qarsoon, Ewrin waxay sheegaty inay nus nolosheeda ku qaadatay buurahan, isla markaana uusan qoyskeeda arag tan iyo markii ay ka soo tagtay.
Waxay sidoo kale sheegtay in xitaa haddii Ali Khamenei uu ku dhintay weerarrada hadda socda, haddana mudaaharaadyo waaweyn oo ay hormuud u ahaayeen haween oo ka dhacay Iiraan tan iyo 2022 ay hore u wiiqeen Jamhuuriyadda Islaamiga ah.
Waxay ka hadlaysaa kacdoonkii ka dhashay geeridii Mahsa Amini, oo ahayd haweeney Kurdi ah oo 22 jir ah oo ay qabteen booliska Iiraan sababtoo ah aysan raacin sharciga ku saabsan xirashada xijaabka.
Xigashada Sawirka, Valentina Sinis
Iiraan waxay si adag uga jawaabtay mudaaharaadyada — kuwaas oo isu beddelay dhaqdhaqaaq loo yaqaan ""Women, Life, Freedom"" — iyadoo qaaday cadaadis iyo xakamayn adag. Si kastaba ha ahaatee, tallaabooyinkaas adag ayaa ku dhiirrigeliyay qaar ka mid ah haweenka inay ku biiraan PJAK.
Ka hor inta aysan ku biirin PJAK, Bigen oo 18 jir ah waxay ka qayb qaadatay mudaaharaadyo waaweyn, waxayna diiday inay xijaab ku xirato dugsiga.
""Haweenku ma haystaan doorashooyin badan,"" ayay tiri Bigen iyadoo timaha u tidcaysa saaxiibteed oo dagaalyahan ah.
""Ama waa inaan u dulqaadannaa rabshadaha qoyska iyo xannibaadaha bulshada, ama waa inaan nafteena ku difaacnaa kacdoon.""
Kooxaha fallaagada Kurdiyaanka ah waxaa marar badan lagu eedeeyaa inay askar ka dhigtaan carruur, Bigen-na weli waxay ahayd ardayad dugsi oo ku sugan Iran markii ay ku biirtay kooxda fallaagada saddex sano ka hor. Dagaalyahanno badan oo halkaas jooga ayaa sheegay in iska-caabbinta hubeysan ay tahay xalka keliya.
""Dagaalkaygu waa inaan hubiyo mustaqbal madax-bannaan oo jiilka xiga ee Kurdiyaanka ah,"" ayay tiri Delal, oo ah dhakhtar ilkaha oo noqotay dagaalyahan markii ay jirtay 23 sano.
""Dadka Kurdiyaanka ah... labadii boqol ee sano ee la soo dhaafay waxaa lagula kacay cadaadis iyo rabshad,"" ayay sii raacisay.
Kooxda PJAK waxaa la aasaasay 2004, waxayna xiriir la leedahay Kurdistan Workers' Party (PKK) — oo ah koox gooni-u-goosad ah oo ka jirta Turkiga, taas oo hubka dhigtay sannadkii hore kadib afartan sano oo dagaal ah oo ay la gashay dowladda Turkiga.
PJAK waxay sheegtay inay ixtiraamayso go'aankaas, laakiin Kurdiyaanka Iiraan ay sii wadi doonaan iska-caabbintooda milatari ee ka dhanka ah Jamhuuriyadda Islaamiga ah ee Iran.
Labada dal ee Turkey iyo Iran waxay u aqoonsadeen kooxdaan urur argagixiso.
Wasaaradda difaaca ee Turkiga ayaa sheegtay inay la socoto dhaqdhaqaaqyada ""kooxda argagixisada PJAK"", iyadoo ku eedeysay inay kicinayso gooni-u-goosad qowmiyadeed oo ay halis gelinayso nabadda iyo xasilloonida gobolka.
© 2026 BBC. BBC masuul kama ahan macluumadka bogagga kale ee dibadda. Akhri xogta ku saabsan sida aan u abaarno bogagga dibadda.",crime-related
https://www.bbc.com/somali/articles/cx2y8epj207o,"Labada waddan ee Afrikaan ah ee haysta diyaaradda F-16
Xigashada Sawirka, Getty Images
Guud ahaan qaaradda Afrika, waxaa jira laba waddan oo haysta diyaaradda F-16 ee caanka ku ah duqaymaha cirka, inta la ogyahay.
Wadamadaas ayaana waxa ay heshiis iib la galeen dowladda Maraykanka, taas oo usoo daabushaay gudaha wadamadooda.
Sida ay qortay wakaaladda wararla ee Reuters sanadkii 2015 kii, dowladda Maraykanka ayaa sideed diyaaradood oo ah nuuca F-16 waxay u daabulayeen dalka Masar.
Xilligaas ayaa waxaa soo hagaagayay xiriirka ka dhaxeeya labada dal, kadib markii milatarigu ay xilka ka tuureen madaxweynihii dalkaas Mohamed Mursi, kadib dibadbaxyo xoogan oo dalka ka dhacay, waxaana si habsami leh u hagaagay xiriirkii Mraykanka kala dhaxeeyay Abdel Fattah al-Sisi, oo badalay Mohamed Mursi.
ligaas soo saartay safaaradda Maraykanka ee dalka Masar, ayaa lagu sheegay in saanad milatari oo xanibaad laga qaaday ay gaari doonto waddanka Masar laba maalin gudahood.
Waxaa lagu sheegay warkaas in saanadda ay ka mid ahayd, afar diyaaradda dagaalka ee F-16.
Waddanka kale ee Afrikaanka ah ee la aaminsan yahay in uu haysto diyaaradda F-16 ayaa ah dalka Morocco, kaas oo heshiis hub la galay dalka Maraykanka.
Sida ay baahisay wakaaladda wararka ee Reuters sanadkii 2007 dii, dowladdii madaxweyne Bush ayaa waxay heshiis la gashay dowladda Morocco, kaa oo ay ka iibsiay 24 diyaaradaha F-16, oo qiimahoodu ku kacayay $2.4 billion oo doolarka Maraykanka ah.
Sidoo kale 2019 kii ayaa mar kale Morocco waxay heshiis diyaarado iibsi ah la gashay dowladda Maraykanka, kaa oo ay doonaysay in ay ku iibsato diyaarado cusub oo F-16 ah, iyo sidoo kale in loo dayactiro kuwii ay horay uga iibsatay Maraykanka.
heshiiskaas ayaa ku kacayay ku dhawaad $4 billion oo doolarka Maraykanka ah.
Inta la ogyahay labadaan waddan ayaa Afrika oo idil ka haysta diyaaradaha dagaalka ee F-16.
Xigashada Sawirka, Getty Images
Warbixinada qotada dheer iyo wararka BBC Somali oo toos kuugu imanaaya WhatsApp.
Iyada oo loo naqshadeeyay qaab yar, oo hadana fudayda ka dhigaya kuna haboon dagaalka hawada, F-16 waxay qaadatay doorar aad u badan oo kala duwan, laga bilaabo weerarada dhulka ilaa iyo kuwa looga hortagga maraakiibta iyo xita doorarka qaadista sawirada sahaminta ganista gantaalaha hawada isaga kala goosha. Tan iyo 2015, waxay ahayd tiradii ugu badnayd ee diyaaradaha milatariga adduunka; in ka badan 2,000 ayaa loo malaynayaa inay weli si firfircoon uga faa'iidaystaan caalamku maanta.
Dhirirka diyaaradaan ayaa ah 15 mitir, waxayna leedahay baal dhirirkiisu gaarayo 9.45 mitir. Waxay ku shaqeysaa matoor koronto dhaliya, kaas oo soo saara 130 kilonewtons oo awooda wax riixda ah, taa oo ku dardargelinaysa diyaaradda in ay ku dhaqaaqdo in ka badan laba jeer xawaaraha codka. Hubka ay xambaarto waxaa ka mid ah madfac wareeg ah oo 20-milimitir ah iyo sidoo kale gantaalo ku rakiban baalasha hoostooda. F-16 waxa uu miisaankeedu yahay 10,000 kg.
Sababaha ay ciidamada cirku ee wadamo badan ay wali u rabaan F-16s waxaa ka mid ah qaabka loo naqshadeeyay iyo casharo adag oo laga bartay dagaalkii hawada ee Vietnam.
F-16 waxay leedahay, Qarniga 21-aad, muhiimad la mid ah tan ay leyihiin diyaaradaha loo adeegsado weerarada dhulka ah - ma ahan wax naqshadeeyayaasheedu ay maanka ku gayeen ama ku dareen sawirada bogaga naqshadeynteeda horraantii 1970-meeyadii. La qabsigaas ayaa u saamaxday in ay qabato doorar aad iyo aad u badan, taas oo ka dhigtay mid soo jiidasho leh oo soo jiidata ciidamada cirka. ""Halka uu khilaaf ka jiro, waxaa laga yaabaa inay jirto F-16 ama ay ku lug leedahay,"" ayuu yiri Robinson oo ah Khabiir ku takhasusay duulista hawada oo ka tirsan Royal Aeronautical Society ee UK.
Naaneysta asalka ah ee F-16 wuxuu ahaa ""Fighting Falcon"", laakiin magacu waligiis ma xayirin, ayuu intaa ku daray Robinson. ""Qofna waligiis ma isticmaalo. Waxay ugu yeeraan Viper, sababta oo ah waxay soo baxday dabayaaqadii 70-meeyadii isla waqti la mid ah [taxanha TV ga] Battlestar Galactica. Waxay u egtahay Viper Colonial, ""Robinson ayaa sidaas leh, isaga oo ku micneynaya gantaalaha hawada sabeeya ee lagu soo bandhigay filmkaas. ""Weli waxay u muuqataa inay mustaqbalka iska leedahay oo sii jiri doonto.""
© 2026 BBC. BBC masuul kama ahan macluumadka bogagga kale ee dibadda. Akhri xogta ku saabsan sida aan u abaarno bogagga dibadda.",crime-related
https://www.bbc.com/somali/articles/cwygpw3dnm7o,"Laamaha ammaanka Libya oo tahriibayaal kasii daayay 'xabsi qarsoodi ah'
Xigashada Sawirka, Getty Images
Hay'adaha amniga ee Liibiya ayaa sii daayay in ka badan 200 oo muhaajiriin ah oo ku xirnaa meel ay ku tilmaameen xabsi qarsoodi ah oo ku yaalla magaalada Kufra ee koonfur bari dalkaas, ka dib markii lagu hayay xaalado bini-aadanimada ka baxsan, sida ay labo ilo-wareed oo dhanka amniga ah u sheegeen wakaaladda Reuters maalintii Axadda.
Ilo-wareedyadan oo codsaday in aan magacooda la xusin ayaa sheegay in ciidanka amnigu ay heleen xabsi dhulka hoostiisa ku yaalla oo qoto dheerkiisu yahay ku dhawaad saddex mitir, kaas oo ay sheegeen in uu maamulayay nin Liibiyaan ah oo ka ganacsada dadka. Mid ka mid ah ilo-wareedyada ayaa sheegay in ninkaas aan weli gacanta lagu dhigin.
""Qaar ka mid ah muhaajiriinta la sii daayay ayaa ilaa laba sano ku xirnaa qolalka dhulka hoostiisa ah,"" ayuu yiri mid ka mid ah ilo-wareedyada. Isha kale ayaa iyaduna sheegtay in waxa ay hawlgalku heleen ay ahaayeen ""mid ka mid ah dambiyada ugu xun ee ka dhanka ah bini-aadanimada ee abid laga helay gobolka.""
""Hawlgalku wuxuu yimid kadib weerar lagu qaaday xabsi qarsoodi ah oo ku dhex yaalla magaalada, halkaas oo laga helay dhowr qol oo dhulka hoostiisa ah oo loogu talagalay xarigga kuwaas oo xaaladoodu ay aad u xumayd,"" ayuu raaciyay mid ka mid ah ilo-wareedyada.
Muhaajiriinta la soo badbaadiyay ayaa ka soo jeeda dalalka ka hooseeya saxaraha Afrika, gaar ahaan Soomaaliya iyo Ereteriya, waxaana ka mid ah haween iyo carruur. Magaalada Kufra waxay dhacdaa bariga Liibiya, waxayna qiyaastii 1,700 oo kiiloomitir u jirtaa caasimadda Tripoli.
Xigashada Sawirka, Getty Images
Liibiya waxay noqotay waddo ay sii maraan muhaajiriinta ka baxsanaya colaadaha iyo faqriga ee u socda Yurub, iyagoo adeegsanaya waddooyin halis ah oo dhex mara saxaraha iyo badda Meditareeniyaanka tan iyo markii xukunka laga tuuray Mucammar Qadaafi kacdoonkii ay taageeraysay NATO ee dhacay sanadkii 2011.
Dhaqaalaha Liibiya ee ku tiirsan saliidda ayaa isna soo jiita muhaajiriinta tabaalaysan ee shaqo doonka ah, balse amniga dalka oo dhan ayaa ah mid liita, taasoo muhaajiriinta u nugleynaysa tacaddiyo.
Ugu yaraan 21 meyd oo muhaajiriin ah ayaa laga helay xabaal wadareed ku taal bariga Liibiya toddobaadkii hore, iyadoo ilaa 10 qof oo ka badbaaday kooxdaas ay ka muuqdeen calaamado muujinaya in la jirdilay ka hor intaan laga soo deyn afduubka, sida ay laba ilo wareed oo dhanka amniga ah u sheegeen Reuters.
Xafiiska xeer ilaaliyaha guud ee Liibiya ayaa bayaan uu soo saaray Jimcihii ku sheegay in mas'uuliyiinta bariga dalka ay maxkamad u gudbiyeen eedeysane loo haysto xabaal wadareedkaas, kaasoo lagu soo eedeeyay ""inuu galay xadgudubyo halis ah oo ka dhan ah muhaajiriinta"".
Bishii Febraayo ee sanadkii hore, 39 meyd oo muhaajiriin ah ayaa laga soo saaray ilaa 55 xabaal wadareed oo ku yaal Kufra. Magaaladaas waxaa ku sugan tobanaan kun oo qaxooti Suudaani ah oo ka soo cararay colaaddii ka qaraxday Suudaan sanadkii 2023
© 2026 BBC. BBC masuul kama ahan macluumadka bogagga kale ee dibadda. Akhri xogta ku saabsan sida aan u abaarno bogagga dibadda.",crime-related
https://www.bbc.com/somali/articles/c4g4qwz14ggo,"125 qof oo IS lala xariirinayo oo lagu qabtay gudaha Turkiga iyo weeraro 'ay qorsheynayeen'
Xigashada Sawirka, Ümit Bektaş/ Reuters
Wasiirka arrimaha gudaha eedalka Turkiga Yerlikaya ayaa saaka ku dhawaaqay in 125 qof oo looga shakisan yahay Daacish lagu soo qabtay howlgalo xilli ah oo laga sameeyay 25 gobol. Eedeysanayaasha ayaa xabsiga la dhigay.
Wasiir Yerlikaya ayaa bayaan uu ku daabacay bartiisa X ku sheegay in howlgallada laga fuliyay gobolada Afyonkarahisar, Ankara, Aydın, Bursa, Eskişehir, Hatay, Kahramanmaraş, Mardin, Mersin, Uşak, Istanbul, Niğde, Sakarya, Kastamonu, Kocaeli, Hakkari, Osmaniye, İzmir, Erevğışr, Denizliz, Izmir. Kırklareli, Şanlıurfa iyo Yalova.
Xafiiska dacwad oogaha guud ee Istanbul ayaa sidoo kale saaka ku dhawaaqay in xabsiga la dhigay 28 qof oo lagu helay in ay ku lug lahaayeen dacaayadda ISIS ka dib weerarkii Yalova ee lagu dilay saddex askari oo boolis ah, iyo hal qof oo lagu helay in uu kaalin firfircoon ku lahaa ururkaas.
Waxaa la sheegay in la qabtay qalab badan oo dijital ah iyo dukumiintiyo abaabul oo laga helay guryaha ay degan yihiin eedaysanayaasha.
Saddex askari oo booliis ah ayaa naftooda ku waayey israsaasayn ka dhalatay weerar ay ISIS ka fulisay Yalova oo ah magaalo yar ku taalla Turkiga 29-kii December.
Howlgalka ayaa waxaa lagu dilay Lix kamid ah ururka Daacish, kuwaasi oo u dhashay dalka Turkiga.
Ka dib iska horimaadyadii ka dhacay Yalova, hawlgal ka dhan ah Daacish ayaa si isku mid ah uga bilowday 21 gobol 30-kii December.
Howlgallada ayaa intii ay socdeen waxaa gacanta lagu soo dhigay 357 qof oo laga shakisan yahay.
Hawlgaladii ugu dambeeyay ayaa la bilaabay ka dib markii ay shegeen in ay heleen xog sirdoon oo sheegaysa in Daacish ay diyaarinayeen weeraro inta lagu guda jiro dabaaldaga sanadka cusub iyo ciida Kirismaska.
December 25 keedii, ayaa lagu dhawaaqay in xabsiga la dhigay 115 qof oo la rumeysan yahay inay xiriir la leeyihiin ururka.
Hawlgal ay si wada jir ah u fuliyeen Hay'adda Sirdoonka Qaranka (MİT) iyo Agaasinka Guud ee Ammaanka 26-kii December, ayaa Ibrahim Burtakuçin, oo ka tirsan Daacish, oo la sheegay inuu isku diyaarinayey inuu weeraro sannadka cusub, lagu xiray Malatya.
Burtakuçin ayaa lagu eedeeyay in uu ""ka wakiil u ahaa ISIS ta"" Turkiga iyo in uu ""doonayay in uu ku biiro"" ururka isaga oo u safrayay goobaha colaadaha.
© 2026 BBC. BBC masuul kama ahan macluumadka bogagga kale ee dibadda. Akhri xogta ku saabsan sida aan u abaarno bogagga dibadda.",crime-related
https://www.bbc.com/somali/articles/cj94lnzdn1wo,"Maxay Iiraan ka yeeli doontaa saddex feyl oo uu gacanta ku hayay Cali Larijani?
Xigashada Sawirka, Anadolu via Getty Images
Duqaynta dhanka cirka ee Israa'iil ay ku dhishay madaxii amniga ee Iiraan, Cali Larijaani, waxay meesha ka saartay mid ka mid ah dadka ugu khibradda iyo saamaynta badan ee go'aannada dalkaas gaadhi jiray xilli xasaasi ah.
Larijaani ma ahayn taliye ciidan, balse wuxuu ahaa shakhsi muhiim u ah qaabaynta xeeladaha fog ee Iiraan. Isagoo ahaa xoghayaha Golaha Amniga Qaranka, wuxuu udub-dhexaad u ahaa go'aammada khuseeya dagaalka, diblomaasiyadda, iyo amniga qaranka. Codkiisu wuxuu miisaan weyn ku lahaa nidaamka dalkaasi oo dhan, gaar ahaan maaraynta loolanka Iiraan kala dhexeeya Maraykanka iyo Israa'iil.
Kaddib markii la dilay Hoggaamiyihii Sare ee Iiraan Cali Khamenei 28-kii Fabruary, Larijaani wuxuu muujiyay dhabar-adayg, isagoo tilmaamay in Iiraan ay u diyaarsan tahay colaad muddo dheer socota. Geeridiisa oo ay xaqiijiyeen warbaahinta dawladdu, waxay ku soo aadday xilli ay socdaan weerarro xidhiidh ah oo lagu laayay saraakiil iyo taliyayaal badan oo sare oo Iiraaniyiin ah toddobaadyadii la soo dhaafay.
Arrintani waxay muujinaysaa dadaal loogu jiro in lagu wiiqo dhismaha hoggaanka Iiraan inta uu dagaalku socdo.
In kasta oo uu mawaaqif adag ka istaagi jiray Reer Galbeedka, Larijaani waxaa gudaha Iiraan looga yaqaannay nin xaqiiqada ku shaqeeya. Wuxuu isku dubbaridi jiray aaminsanaanta adag ee dhanka mabda'a iyo hab-raaca gorfaynta ku dhisnaa.
Wuxuu aad uga shakisanaa la macaamilka reer Galbeedka, balse wuxuu qayb muhiim ah ka ahaa dadaallada diblomaasiyadeed oo ay ka mid ahayd kaalintii uu ku lahaa heshiiskii iskaashi ee muddada dheer ee dhex maray Iiraan iyo Shiinaha.
Dhimashadiisu waxa ay saamayn doontaa saddex gal oo muhiim ah.
1. Dagaalka hadda socda: Wuxuu ku doodi jiray in Iiraan ay tahay in ay u diyaar garowdo iska horimaad muddo dheer qaata, dagaalkuna uu ku fido gobolka oo dhan iyo meelo ka fogba oo ay ku jirto xidhidda Marinka Hormuz.
2. Kacdoonnada gudaha: Mowjado xasillooni darro ah oo ka dhashay cabashooyin dhanka dhaqaalaha ayaa si degdeg ah isugu beddelay dibadbaxyo xoogggan oo looga soo horjeedo Jamhuuriyadda Islaamiga ah. Kacdoonnadaas waxaa lagaga jawaabay olole lagu laayay kumannaan dibadbaxayaal ah guud ahaan dalka.
3. Barnaamijka Nukliyeerka: Tani waxay la xidhiidhay joojinta wadahadalladii tooska ahaa ee lala lahaa Washington, kuwaas oo markii dambana ay waxyeelleeyeen weerarrada millatari ee dhacay.
Geerida Larijaani waxay ka tagtay arrimahan oo aan wali xal loo helin, waxaana loo baahan doonaa beddelkiisa oo aan wali la aqoon, kaas oo wajihi doona xaalad aad u cakiran. In kasta oo Iiraan ay muujisay adkaysi, iyadoo qayb ahaan carqaladaynaysa suuqyada tamarta adduunka, ayaa haddana hawadeedu waxay wali u furan tahay weerarro joogto ah. Hoggaamiye kasta oo cusub wuxuu wajahayaa halis degdeg ah oo ah in la beegsado.
Xigashada Sawirka, Anadolu via Getty Images
Warbixinada qotada dheer iyo wararka BBC Somali oo toos kuugu imanaaya WhatsApp.
Tallaabadani waxay u muuqataa inay awoodda dalka u wareejinayso dhanka millatariga. Hadalladii ugu dambeeyay ee ka soo yeedhay Madaxweyne Masoud Pezeshkian ayaa tilmaamaya in ciidamada qalabka sida la siiyay awood ballaaran haddii hoggaanka sare uu gudan waayo waajibaadkiisa. Ficil ahaan, taasi waxay ka dhigan tahay in go'aannada la qaadan karo si degdeg ah, balse waxaa yaraanaya isku dubbaridka dhexe.
Iiraan waxay dib u dhigtay ogeysiisyada dadweynaha, waxayna qarisay halka ay ku sugan yihiin shakhsiyaad muhiim ah, oo uu ka mid yahay hoggaamiyaha cusub ee sare, Mojtaba Khamenei; lama oga inay ka tahay sababo amni iyo inay tahay hubanti la'aan ka dhex jirta gudaha dalka.
Taliyaha ciidammada Iiraan Amir Hatami ayaa ku hanjabay in uu aargoosi ka samayn doono dilka Larijaani. Si kastaba ha ahaatee, waqti kaddib, nidaamka Iiraan wuxuu wajahayaa dhibaato dhanka shaqada ah, gaar ahaan dal ay ku nool yihiin dad ka badan 90 milyan oo qof.
Sidaas darteed, saamaynta geerida Larijaani ma ahan kaliya luminta hal sarkaal. Waxay sii hurinaysaa qalalaasaha hoggaanka, kaas oo saamayn ku yeelan kara jihada uu dagaalku u socdo iyo xasilloonida qaranka Iiraan laf ahaantiisa.
© 2026 BBC. BBC masuul kama ahan macluumadka bogagga kale ee dibadda. Akhri xogta ku saabsan sida aan u abaarno bogagga dibadda.",crime-related
